{"assessment_id":"sha256:477efade158e6264ffeb0ff49d754190a9724ae437d6a0e6e0c0350222624f7e","assessor":"validator","axes":{"algorithmic_cross_engine_reproduction":"none","capability_state":"ready","causal_identification":"not_applicable","engine_execution":"completed","exercise_level":"actual_compute","formal_check":"checked","formal_scope":"exact_statement","independent_empirical_replication":"none","integration_authority":"proposal_only","scientific_check":"checked","statistical_support":"none"},"canonical_writes":0,"created_utc":"2026-07-28T00:00:00Z","evidence_refs":["sha256:eeeeeeeeeeeeeeeeeeeeeeeeeeeeeeeeeeeeeeeeeeeeeeeeeeeeeeeeeeeeeeee"],"grants_authority":false,"parents":[],"schema_version":"EvidenceAssessment/v1","subject_claim_id":"sha256:cccccccccccccccccccccccccccccccccccccccccccccccccccccccccccccccc"}
