{"assessment_id":"sha256:9c3f8c78f404880bb61ebea52945af7e63e5e88229a775b84505b6a920fb0f93","assessor":"operator","axes":{"algorithmic_cross_engine_reproduction":"none","capability_state":"declared","causal_identification":"not_applicable","engine_execution":"not_run","exercise_level":"import_probe","formal_check":"not_applicable","formal_scope":"none","independent_empirical_replication":"none","integration_authority":"none","scientific_check":"unchecked","statistical_support":"none"},"canonical_writes":0,"created_utc":"2026-07-28T00:00:00Z","evidence_refs":[],"grants_authority":false,"parents":[],"schema_version":"EvidenceAssessment/v1","subject_claim_id":"sha256:cccccccccccccccccccccccccccccccccccccccccccccccccccccccccccccccc"}
